{
  "entries": [
    {
      "candidate_entry_offset": 59758,
      "expression": "$240032",
      "is_big_chest": false,
      "item_value": 36,
      "literal_value": 2359346,
      "room_value": 50,
      "source_line": 15113,
      "source_revision": "347c23f9fc019c72d32da537c9cb235f468d021d",
      "table_index": 0
    },
    {
      "candidate_entry_offset": 59761,
      "expression": "$120055",
      "is_big_chest": false,
      "item_value": 18,
      "literal_value": 1179733,
      "room_value": 85,
      "source_line": 15113,
      "source_revision": "347c23f9fc019c72d32da537c9cb235f468d021d",
      "table_index": 1
    },
    {
      "candidate_entry_offset": 59764,
      "expression": "$0C0071",
      "is_big_chest": false,
      "item_value": 12,
      "literal_value": 786545,
      "room_value": 113,
      "source_line": 15113,
      "source_revision": "347c23f9fc019c72d32da537c9cb235f468d021d",
      "table_index": 2
    },
    {
      "candidate_entry_offset": 59767,
      "expression": "$2500A8",
      "is_big_chest": false,
      "item_value": 37,
      "literal_value": 2425000,
      "room_value": 168,
      "source_line": 15113,
      "source_revision": "347c23f9fc019c72d32da537c9cb235f468d021d",
      "table_index": 3
    },
    {
      "candidate_entry_offset": 59770,
      "expression": "$190113",
      "is_big_chest": false,
      "item_value": 25,
      "literal_value": 1638675,
      "room_value": 275,
      "source_line": 15113,
      "source_revision": "347c23f9fc019c72d32da537c9cb235f468d021d",
      "table_index": 4
    },
    {
      "candidate_entry_offset": 59773,
      "expression": "$0B80A9",
      "is_big_chest": true,
      "item_value": 11,
      "literal_value": 753833,
      "room_value": 169,
      "source_line": 15113,
      "source_revision": "347c23f9fc019c72d32da537c9cb235f468d021d",
      "table_index": 5
    },
    {
      "candidate_entry_offset": 59776,
      "expression": "$280016",
      "is_big_chest": false,
      "item_value": 40,
      "literal_value": 2621462,
      "room_value": 22,
      "source_line": 15113,
      "source_revision": "347c23f9fc019c72d32da537c9cb235f468d021d",
      "table_index": 6
    },
    {
      "candidate_entry_offset": 59779,
      "expression": "$250016",
      "is_big_chest": false,
      "item_value": 37,
      "literal_value": 2424854,
      "room_value": 22,
      "source_line": 15113,
      "source_revision": "347c23f9fc019c72d32da537c9cb235f468d021d",
      "table_index": 7
    },
    {
      "candidate_entry_offset": 59782,
      "expression": "$330037",
      "is_big_chest": false,
      "item_value": 51,
      "literal_value": 3342391,
      "room_value": 55,
      "source_line": 15114,
      "source_revision": "347c23f9fc019c72d32da537c9cb235f468d021d",
      "table_index": 8
    },
    {
      "candidate_entry_offset": 59785,
      "expression": "$0A8036",
      "is_big_chest": true,
      "item_value": 10,
      "literal_value": 688182,
      "room_value": 54,
      "source_line": 15114,
      "source_revision": "347c23f9fc019c72d32da537c9cb235f468d021d",
      "table_index": 9
    },
    {
      "candidate_entry_offset": 59788,
      "expression": "$28010B",
      "is_big_chest": false,
      "item_value": 40,
      "literal_value": 2621707,
      "room_value": 267,
      "source_line": 15114,
      "source_revision": "347c23f9fc019c72d32da537c9cb235f468d021d",
      "table_index": 10
    },
    {
      "candidate_entry_offset": 59791,
      "expression": "$1B8073",
      "is_big_chest": true,
      "item_value": 27,
      "literal_value": 1802355,
      "room_value": 115,
      "source_line": 15114,
      "source_revision": "347c23f9fc019c72d32da537c9cb235f468d021d",
      "table_index": 11
    },
    {
      "candidate_entry_offset": 59794,
      "expression": "$250067",
      "is_big_chest": false,
      "item_value": 37,
      "literal_value": 2424935,
      "room_value": 103,
      "source_line": 15114,
      "source_revision": "347c23f9fc019c72d32da537c9cb235f468d021d",
      "table_index": 12
    },
    {
      "candidate_entry_offset": 59797,
      "expression": "$28007E",
      "is_big_chest": false,
      "item_value": 40,
      "literal_value": 2621566,
      "room_value": 126,
      "source_line": 15114,
      "source_revision": "347c23f9fc019c72d32da537c9cb235f468d021d",
      "table_index": 13
    },
    {
      "candidate_entry_offset": 59800,
      "expression": "$078058",
      "is_big_chest": true,
      "item_value": 7,
      "literal_value": 491608,
      "room_value": 88,
      "source_line": 15114,
      "source_revision": "347c23f9fc019c72d32da537c9cb235f468d021d",
      "table_index": 14
    },
    {
      "candidate_entry_offset": 59803,
      "expression": "$330058",
      "is_big_chest": false,
      "item_value": 51,
      "literal_value": 3342424,
      "room_value": 88,
      "source_line": 15114,
      "source_revision": "347c23f9fc019c72d32da537c9cb235f468d021d",
      "table_index": 15
    },
    {
      "candidate_entry_offset": 59806,
      "expression": "$320057",
      "is_big_chest": false,
      "item_value": 50,
      "literal_value": 3276887,
      "room_value": 87,
      "source_line": 15115,
      "source_revision": "347c23f9fc019c72d32da537c9cb235f468d021d",
      "table_index": 16
    },
    {
      "candidate_entry_offset": 59809,
      "expression": "$240057",
      "is_big_chest": false,
      "item_value": 36,
      "literal_value": 2359383,
      "room_value": 87,
      "source_line": 15115,
      "source_revision": "347c23f9fc019c72d32da537c9cb235f468d021d",
      "table_index": 17
    },
    {
      "candidate_entry_offset": 59812,
      "expression": "$32001F",
      "is_big_chest": false,
      "item_value": 50,
      "literal_value": 3276831,
      "room_value": 31,
      "source_line": 15115,
      "source_revision": "347c23f9fc019c72d32da537c9cb235f468d021d",
      "table_index": 18
    },
    {
      "candidate_entry_offset": 59815,
      "expression": "$24007E",
      "is_big_chest": false,
      "item_value": 36,
      "literal_value": 2359422,
      "room_value": 126,
      "source_line": 15115,
      "source_revision": "347c23f9fc019c72d32da537c9cb235f468d021d",
      "table_index": 19
    },
    {
      "candidate_entry_offset": 59818,
      "expression": "$22809E",
      "is_big_chest": true,
      "item_value": 34,
      "literal_value": 2261150,
      "room_value": 158,
      "source_line": 15115,
      "source_revision": "347c23f9fc019c72d32da537c9cb235f468d021d",
      "table_index": 20
    },
    {
      "candidate_entry_offset": 59821,
      "expression": "$330077",
      "is_big_chest": false,
      "item_value": 51,
      "literal_value": 3342455,
      "room_value": 119,
      "source_line": 15115,
      "source_revision": "347c23f9fc019c72d32da537c9cb235f468d021d",
      "table_index": 21
    },
    {
      "candidate_entry_offset": 59824,
      "expression": "$280005",
      "is_big_chest": false,
      "item_value": 40,
      "literal_value": 2621445,
      "room_value": 5,
      "source_line": 15115,
      "source_revision": "347c23f9fc019c72d32da537c9cb235f468d021d",
      "table_index": 22
    },
    {
      "candidate_entry_offset": 59827,
      "expression": "$4000B9",
      "is_big_chest": false,
      "item_value": 64,
      "literal_value": 4194489,
      "room_value": 185,
      "source_line": 15115,
      "source_revision": "347c23f9fc019c72d32da537c9cb235f468d021d",
      "table_index": 23
    },
    {
      "candidate_entry_offset": 59830,
      "expression": "$330074",
      "is_big_chest": false,
      "item_value": 51,
      "literal_value": 3342452,
      "room_value": 116,
      "source_line": 15116,
      "source_revision": "347c23f9fc019c72d32da537c9cb235f468d021d",
      "table_index": 24
    },
    {
      "candidate_entry_offset": 59833,
      "expression": "$3200B8",
      "is_big_chest": false,
      "item_value": 50,
      "literal_value": 3276984,
      "room_value": 184,
      "source_line": 15116,
      "source_revision": "347c23f9fc019c72d32da537c9cb235f468d021d",
      "table_index": 25
    },
    {
      "candidate_entry_offset": 59836,
      "expression": "$120104",
      "is_big_chest": false,
      "item_value": 18,
      "literal_value": 1179908,
      "room_value": 260,
      "source_line": 15116,
      "source_revision": "347c23f9fc019c72d32da537c9cb235f468d021d",
      "table_index": 26
    },
    {
      "candidate_entry_offset": 59839,
      "expression": "$4100FE",
      "is_big_chest": false,
      "item_value": 65,
      "literal_value": 4260094,
      "room_value": 254,
      "source_line": 15116,
      "source_revision": "347c23f9fc019c72d32da537c9cb235f468d021d",
      "table_index": 27
    },
    {
      "candidate_entry_offset": 59842,
      "expression": "$320075",
      "is_big_chest": false,
      "item_value": 50,
      "literal_value": 3276917,
      "room_value": 117,
      "source_line": 15116,
      "source_revision": "347c23f9fc019c72d32da537c9cb235f468d021d",
      "table_index": 28
    },
    {
      "candidate_entry_offset": 59845,
      "expression": "$17010C",
      "is_big_chest": false,
      "item_value": 23,
      "literal_value": 1507596,
      "room_value": 268,
      "source_line": 15116,
      "source_revision": "347c23f9fc019c72d32da537c9cb235f468d021d",
      "table_index": 29
    },
    {
      "candidate_entry_offset": 59848,
      "expression": "$240068",
      "is_big_chest": false,
      "item_value": 36,
      "literal_value": 2359400,
      "room_value": 104,
      "source_line": 15116,
      "source_revision": "347c23f9fc019c72d32da537c9cb235f468d021d",
      "table_index": 30
    },
    {
      "candidate_entry_offset": 59851,
      "expression": "$250085",
      "is_big_chest": false,
      "item_value": 37,
      "literal_value": 2424965,
      "room_value": 133,
      "source_line": 15116,